{"added_requirement_ids":["R2"],"contract_sha256":"22321e4c2acd238513dd6448f038224aec56b3062226d55415dc43d5ff156ef4","mappings":[{"disposition":"preserved","from":["R1"],"reason":"Original rejection promise unchanged; semantic equivalence remains an audit obligation","source_refs":[{"line_end":1,"line_start":1,"quote":"Reject empty and whitespace-only usernames","source_id":"S1"}],"to":["R1"]}],"other_changes":[],"predecessor_contract_sha256":"d90bb780c7b0a6769cfded322e69aeed1ad716dba94faf6dea5a256f588f0c43","predecessor_source_bundle_sha256":"d1912c64f2aab0cc80e202a345c06559626aabde5eef3b5fd0c311e25800e25d","record":"intentline.continuity","schema_version":1,"source_bundle_sha256":"6a28ccbf853807ddbc5971d18596c6a4b699fee54aeecb2a24ce0f140d9d3d47"}
